Timestamp,Causa,Emoción ,Género ,Edad,Protagonismo,Narrativa,Personaje,Reacción social,Responsabilidad Atribuida,Duración,Notas
1:11:13,Evento positivo,Felicidad,Femenino,Adulta,Principal,Desarrollo ,Nahoko Satomi ,Palabras de apoyo,Ella misma,4 sec,Introducción del personaje propiamente tal. Ella le reza al río para que Jiro aparezca
1:24:50,Evento positivo,Felicidad,Masculino,Adulto,Segundario ,Desarrollo ,Padre de Nahoko,Palabras de apoyo,Familia,6 sec,Padre de Nahoko llorando por su compromiso a Jiro
1:29:40,Evento positivo,Humor,Masculino,Adulto,Segundario ,Desarrollo ,Kurokawa,Ignorar,Amigos,2 sec,Kurokawa se burla que Jiro este comprometido
1:31:48,Sufrimiento psicológico,Tristeza,Masculino,Adulto,Principal,Desarrollo ,Jiro,No aplica,Familia,2 sec,Jiro descubre que Nahoko tuvo una hemorragia. Muchas lágrimas!!
1:32:17,Sufrimiento psicológico,Tristeza,Masculino,Adulto,Principal,Desarrollo ,Jiro,No aplica,Familia,10 sec,Trayecto de Jiro a Tokio; lágrimas en papel
1:33:55,Sufrimiento psicológico/Dolor físico,Tristeza,Femenino,Adulto,Principal,Desarrollo ,Nahoko Satomi ,Palabras de apoyo/Comfort físico,Familia,2 sec,Nahoko encontrandose con Jiro
1:45:52,Evento postivo,Gratitud,Femenino,Adulto,Principal,Desarrollo ,Nahoko Satomi ,Palabras de apoyo,Amigos,2 sec ,Nahoko llora al finalmente casarse con Jiro
1:48:08,Sufrimiento psicológico,Frustración ,Femenino,Adulto,Segundario ,Desarrollo ,Kayo,No sabe como comportarse,Familia,4 sec,Kayo llorando por la manera en la que Jiro deja sola a Nahoko 
1:57:06,Perdida,Duelo,Femenino,Adulto,Segundario ,Climax,Kayo,No aplica,Familia,6 sec,Kayo llorando tras la partida de Nahoko